feature_ID,feature name,feature description,meta_feature_id,collection_id,collection URL,collection numbers
134,"Order of Subject, Object and Verb: VOS",,106,3,http://wals.info/feature/81A,81A-4
135,"Order of Subject, Object and Verb: OVS",,108,3,http://wals.info/feature/81A,81A-5
136,"Order of Subject, Object and Verb: OSV",,109,3,http://wals.info/feature/81A,81A-6
137,"Order of Subject, Object and Verb: No dominant order",,110,3,http://wals.info/feature/81A,81A-7
138,Occurrence of nominal plural markers: No plural marking,,111,1,http://apics-online.info/parameters/22,22-1
139,Occurrence of nominal plural markers: Variable plural marking of human nouns,,114,1,http://apics-online.info/parameters/22,22-2
140,Occurrence of nominal plural markers: Variable plural marking of human or inanimate nouns,,113,1,http://apics-online.info/parameters/22,22-3
141,Occurrence of nominal plural markers: Invariant plural marking,,112,1,http://apics-online.info/parameters/22,22-4
